{
  "type": "object",
  "additionalProperties": false,
  "properties": {
    "schema_version": {
      "const": "2.0-draft",
      "description": "계약 형식 버전. SSE는 1, 새 Workflow는 2.0-draft, legacy 예제는 1.3을 사용한다. 정의 수정 횟수와 구분한다. 필수 필드."
    },
    "workflow_id": {
      "$ref": "#/$defs/id",
      "description": "재사용 Workflow 정의를 식별하는 문자열. 기존 Workflow 관리 API의 DB UUID와 구분한다. 필수 필드."
    },
    "definition_version": {
      "type": "integer",
      "minimum": 1,
      "description": "동일 Workflow 정의의 변경 버전. 승인 화면 편집 횟수나 Run ID가 아니다. 필수 필드."
    },
    "name": {
      "type": "string",
      "minLength": 1,
      "description": "해당 입력·계획·Skill·함수 인자 등의 이름. binding의 name은 Workflow 입력 키를 참조한다. 필수 필드."
    },
    "description": {
      "type": "string",
      "minLength": 1,
      "description": "해당 정의·입력·Skill·Step·산출물의 의미를 사람이 읽을 수 있게 설명한 문자열. 필수 필드."
    },
    "goal": {
      "type": "string",
      "minLength": 1,
      "description": "Workflow 또는 계획이 달성하려는 분석 목표. 필수 필드."
    },
    "tags": {
      "type": "array",
      "items": {
        "type": "string",
        "minLength": 1
      },
      "uniqueItems": true,
      "description": "정의·검색·분류에 사용하는 문자열 태그 목록. 생략 가능한 필드. 조건부 필수 여부는 업무 계약을 함께 확인한다."
    },
    "inputs": {
      "type": "object",
      "propertyNames": {
        "type": "string",
        "pattern": "^[a-z][a-z0-9_.-]*$",
        "maxLength": 150
      },
      "additionalProperties": {
        "$ref": "#/$defs/input"
      },
      "description": "새 Workflow에서는 입력 이름별 정의 객체, PlanView에서는 입력 필드 목록, legacy에서는 실행 입력값 객체다. 필수 필드."
    },
    "steps": {
      "type": "array",
      "minItems": 1,
      "items": {
        "$ref": "#/$defs/step"
      },
      "description": "분석 단계 목록. 새 Workflow의 Step은 하나의 등록 Tool을 참조하며 depends_on으로 선후관계를 정한다. 필수 필드."
    },
    "decisions": {
      "type": "array",
      "items": {
        "$ref": "#/$defs/decision"
      },
      "description": "실행 결과를 보고 나중에 확정할 판단 목록. 정적 계획과 결과 기반 판단을 분리한다. 필수 필드."
    },
    "execution": {
      "$ref": "#/$defs/execution",
      "description": "새 Workflow/PlanView에서는 실행 정책 객체. legacy Step/Tool에서는 실행 조건 값이다. 생략 가능한 필드. 조건부 필수 여부는 업무 계약을 함께 확인한다."
    },
    "expected_outputs": {
      "type": "array",
      "minItems": 1,
      "items": {
        "$ref": "#/$defs/output"
      },
      "description": "Workflow가 기대하는 분석 결과·데이터·보고서 선언. 선언만으로 파일이 생성되는 것은 아니다. 필수 필드."
    }
  },
  "required": [
    "schema_version",
    "workflow_id",
    "definition_version",
    "name",
    "description",
    "goal",
    "inputs",
    "steps",
    "decisions",
    "expected_outputs"
  ],
  "$schema": "https://json-schema.org/draft/2020-12/schema",
  "$id": "urn:dtest:workflow-definition:2.0-draft",
  "title": "Registered analysis Workflow definition",
  "$defs": {
    "id": {
      "type": "string",
      "pattern": "^[a-z][a-z0-9_.-]*$",
      "maxLength": 150
    },
    "binding": {
      "oneOf": [
        {
          "type": "object",
          "additionalProperties": false,
          "properties": {
            "source": {
              "const": "workflow_input",
              "description": "값을 얻는 방식. workflow_input/literal/step_output/agent_decision/system_context, 보고서에서는 agent_report를 구분한다. 필수 필드."
            },
            "name": {
              "$ref": "#/$defs/id",
              "description": "해당 입력·계획·Skill·함수 인자 등의 이름. binding의 name은 Workflow 입력 키를 참조한다. 필수 필드."
            }
          },
          "required": [
            "source",
            "name"
          ]
        },
        {
          "type": "object",
          "additionalProperties": false,
          "properties": {
            "source": {
              "const": "literal",
              "description": "값을 얻는 방식. workflow_input/literal/step_output/agent_decision/system_context, 보고서에서는 agent_report를 구분한다. 필수 필드."
            },
            "value": {
              "description": "직접 지정한 값·편집값·판단값. 의미와 허용 타입은 해당 입력 또는 파라미터 schema를 따른다. 필수 필드."
            }
          },
          "required": [
            "source",
            "value"
          ]
        },
        {
          "type": "object",
          "additionalProperties": false,
          "properties": {
            "source": {
              "const": "step_output",
              "description": "값을 얻는 방식. workflow_input/literal/step_output/agent_decision/system_context, 보고서에서는 agent_report를 구분한다. 필수 필드."
            },
            "step_id": {
              "$ref": "#/$defs/id",
              "description": "대상 Step의 ID. 편집 대상으로 지정하거나 이전 결과·의존성·근거를 참조할 때 쓴다. 필수 필드."
            },
            "selector": {
              "type": "array",
              "items": {
                "oneOf": [
                  {
                    "type": "string",
                    "minLength": 1
                  },
                  {
                    "type": "integer",
                    "minimum": 0
                  }
                ]
              },
              "description": "이전 Step 반환값에서 추출할 키·인덱스 경로 배열. []는 반환값 전체이며 새 규격은 Python 식을 평가하지 않는다. legacy는 문자열 selector다. 필수 필드."
            }
          },
          "required": [
            "source",
            "step_id",
            "selector"
          ]
        },
        {
          "type": "object",
          "additionalProperties": false,
          "properties": {
            "source": {
              "const": "agent_decision",
              "description": "값을 얻는 방식. workflow_input/literal/step_output/agent_decision/system_context, 보고서에서는 agent_report를 구분한다. 필수 필드."
            },
            "decision_id": {
              "$ref": "#/$defs/id",
              "description": "결과 기반 Agent 판단의 ID. 판단 정의·확인 화면·Tool 인자의 연결에 사용한다. 필수 필드."
            }
          },
          "required": [
            "source",
            "decision_id"
          ]
        },
        {
          "type": "object",
          "additionalProperties": false,
          "properties": {
            "source": {
              "const": "system_context",
              "description": "값을 얻는 방식. workflow_input/literal/step_output/agent_decision/system_context, 보고서에서는 agent_report를 구분한다. 필수 필드."
            },
            "key": {
              "enum": [
                "user_id",
                "project_id",
                "session_id",
                "dataset_output_dir"
              ],
              "description": "system_context binding이 참조할 서버 제공 문맥 키. 필수 필드."
            }
          },
          "required": [
            "source",
            "key"
          ]
        }
      ]
    },
    "condition": {
      "oneOf": [
        {
          "type": "object",
          "additionalProperties": false,
          "properties": {
            "op": {
              "enum": [
                "eq",
                "ne",
                "gt",
                "gte",
                "lt",
                "lte",
                "in",
                "not_in"
              ],
              "description": "비교 연산자. eq/ne/gt/gte/lt/lte/in/not_in 중 schema가 허용한 값을 쓴다. 필수 필드."
            },
            "left": {
              "$ref": "#/$defs/binding",
              "description": "조건 비교의 왼쪽 값 binding. 필수 필드."
            },
            "right": {
              "$ref": "#/$defs/binding",
              "description": "조건 비교의 오른쪽 값 binding. 필수 필드."
            }
          },
          "required": [
            "op",
            "left",
            "right"
          ]
        },
        {
          "type": "object",
          "additionalProperties": false,
          "properties": {
            "all": {
              "type": "array",
              "minItems": 1,
              "items": {
                "$ref": "#/$defs/condition"
              },
              "description": "하위 조건이 모두 참일 때 참인 AND 조건 배열. 필수 필드."
            }
          },
          "required": [
            "all"
          ]
        },
        {
          "type": "object",
          "additionalProperties": false,
          "properties": {
            "any": {
              "type": "array",
              "minItems": 1,
              "items": {
                "$ref": "#/$defs/condition"
              },
              "description": "하위 조건 중 하나 이상 참일 때 참인 OR 조건 배열. 필수 필드."
            }
          },
          "required": [
            "any"
          ]
        },
        {
          "type": "object",
          "additionalProperties": false,
          "properties": {
            "not": {
              "$ref": "#/$defs/condition",
              "description": "하위 조건의 결과를 뒤집는 NOT 조건. 필수 필드."
            }
          },
          "required": [
            "not"
          ]
        }
      ]
    },
    "input": {
      "type": "object",
      "additionalProperties": false,
      "properties": {
        "title": {
          "type": "string",
          "minLength": 1,
          "description": "사용자 화면의 표시 제목. value_schema 내부에서는 JSON Schema 표시 제목이다. 필수 필드."
        },
        "description": {
          "type": "string",
          "minLength": 1,
          "description": "해당 정의·입력·Skill·Step·산출물의 의미를 사람이 읽을 수 있게 설명한 문자열. 필수 필드."
        },
        "kind": {
          "enum": [
            "parameter",
            "data_reference"
          ],
          "description": "대상 객체 종류. HITL은 plan_review/planning_question/decision_review/repair_review이며 입력·파라미터·산출물에도 각각 별도의 kind가 있다. 필수 필드."
        },
        "required": {
          "type": "boolean",
          "description": "이 입력 또는 산출물이 업무 실행에 필요한지 표시하는 boolean. 필드 자체의 필수 여부와 구분한다. 필수 필드."
        },
        "editable": {
          "type": "boolean",
          "description": "사용자가 수정할 수 있는지 표시한다. true여도 value_schema 및 실행 정책 검증을 통과해야 한다. 필수 필드."
        },
        "value_schema": {
          "type": [
            "object",
            "boolean"
          ],
          "description": "입력·편집값을 검증하는 JSON Schema 객체 또는 boolean. 필수 여부 및 값 유효성은 별도다. 필수 필드."
        },
        "default": {
          "description": "Workflow 입력의 기본값. 해당 value_schema를 만족해야 하며 사용자 수정 정책을 함께 따른다. 생략 가능한 필드. 조건부 필수 여부는 업무 계약을 함께 확인한다."
        }
      },
      "required": [
        "title",
        "description",
        "kind",
        "required",
        "editable",
        "value_schema"
      ]
    },
    "step": {
      "type": "object",
      "additionalProperties": false,
      "properties": {
        "id": {
          "$ref": "#/$defs/id",
          "description": "Workflow 내부 Step의 고유 문자열 ID. depends_on·step_output이 참조한다. 필수 필드."
        },
        "skill_id": {
          "$ref": "#/$defs/id",
          "description": "레포에 등록된 Skill의 고유 식별자. 그 Skill에 속한 Tool을 참조해야 한다. 필수 필드."
        },
        "tool_id": {
          "$ref": "#/$defs/id",
          "description": "레포에 등록된 실행 가능한 Tool의 고유 식별자. 필수 필드."
        },
        "description": {
          "type": "string",
          "minLength": 1,
          "description": "해당 정의·입력·Skill·Step·산출물의 의미를 사람이 읽을 수 있게 설명한 문자열. 필수 필드."
        },
        "depends_on": {
          "type": "array",
          "items": {
            "$ref": "#/$defs/id"
          },
          "uniqueItems": true,
          "description": "먼저 완료되어야 하는 Step ID 목록. 단순 배열 순서와 구분되며 순환 의존성은 허용하지 않는다. 필수 필드."
        },
        "arguments": {
          "type": "object",
          "propertyNames": {
            "type": "string",
            "pattern": "^[a-z][a-z0-9_.-]*$",
            "maxLength": 150
          },
          "additionalProperties": {
            "$ref": "#/$defs/binding"
          },
          "description": "새 Workflow에서는 실제 함수 인자 이름별 binding. legacy에서는 인자 값 또는 참조가 들어간다. 필수 필드."
        },
        "when": {
          "$ref": "#/$defs/condition",
          "description": "단계 또는 산출물의 조건. false이면 해당 항목을 실행/요구하지 않으며 자유 Python 조건문을 입력하지 않는다. 생략 가능한 필드. 조건부 필수 여부는 업무 계약을 함께 확인한다."
        },
        "parameter_controls": {
          "type": "object",
          "propertyNames": {
            "$ref": "#/$defs/id"
          },
          "additionalProperties": {
            "type": "object",
            "additionalProperties": false,
            "required": [
              "editable",
              "value_schema"
            ],
            "properties": {
              "editable": {
                "type": "boolean",
                "description": "사용자가 수정할 수 있는지 표시한다. true여도 value_schema 및 실행 정책 검증을 통과해야 한다. 필수 필드."
              },
              "value_schema": {
                "type": [
                  "object",
                  "boolean"
                ],
                "description": "입력·편집값을 검증하는 JSON Schema 객체 또는 boolean. 필수 여부 및 값 유효성은 별도다. 필수 필드."
              }
            }
          },
          "description": "Tool 인자 이름별 편집 허용·값 schema. literal/판단 인자의 사용자 편집 규칙을 정의한다. 생략 가능한 필드. 조건부 필수 여부는 업무 계약을 함께 확인한다."
        }
      },
      "required": [
        "id",
        "skill_id",
        "tool_id",
        "description",
        "depends_on",
        "arguments"
      ]
    },
    "decision": {
      "type": "object",
      "additionalProperties": false,
      "properties": {
        "id": {
          "$ref": "#/$defs/id",
          "description": "Workflow 내부 Agent 판단의 고유 문자열 ID. agent_decision이 참조한다. 필수 필드."
        },
        "after_steps": {
          "type": "array",
          "items": {
            "$ref": "#/$defs/id"
          },
          "minItems": 1,
          "uniqueItems": true,
          "description": "Agent가 판단하기 전에 결과를 확보해야 하는 Step ID 목록. 필수 필드."
        },
        "instruction": {
          "type": "string",
          "minLength": 1,
          "description": "결과를 읽고 판단값을 확정하는 Agent용 지침. 필수 필드."
        },
        "output_schema": {
          "type": [
            "object",
            "boolean"
          ],
          "description": "Agent 판단 결과값을 검증하는 JSON Schema. 예를 들어 boolean 또는 선택지 enum을 정의한다. 필수 필드."
        }
      },
      "required": [
        "id",
        "after_steps",
        "instruction",
        "output_schema"
      ]
    },
    "output": {
      "type": "object",
      "additionalProperties": false,
      "properties": {
        "id": {
          "$ref": "#/$defs/id",
          "description": "Workflow 내부 예상 산출물의 고유 문자열 ID. 필수 필드."
        },
        "kind": {
          "enum": [
            "analysis_result",
            "dataset",
            "report"
          ],
          "description": "산출물 종류. analysis_result는 분석 반환값, dataset은 저장 데이터, report는 보고서다. 필수 필드."
        },
        "description": {
          "type": "string",
          "minLength": 1,
          "description": "해당 정의·입력·Skill·Step·산출물의 의미를 사람이 읽을 수 있게 설명한 문자열. 필수 필드."
        },
        "required": {
          "type": "boolean",
          "description": "이 입력 또는 산출물이 업무 실행에 필요한지 표시하는 boolean. 필드 자체의 필수 여부와 구분한다. 필수 필드."
        },
        "source": {
          "oneOf": [
            {
              "type": "object",
              "additionalProperties": false,
              "properties": {
                "source": {
                  "const": "step_output",
                  "description": "값을 얻는 방식. workflow_input/literal/step_output/agent_decision/system_context, 보고서에서는 agent_report를 구분한다. 필수 필드."
                },
                "step_id": {
                  "$ref": "#/$defs/id",
                  "description": "대상 Step의 ID. 편집 대상으로 지정하거나 이전 결과·의존성·근거를 참조할 때 쓴다. 필수 필드."
                },
                "selector": {
                  "type": "array",
                  "items": {
                    "oneOf": [
                      {
                        "type": "string",
                        "minLength": 1
                      },
                      {
                        "type": "integer",
                        "minimum": 0
                      }
                    ]
                  },
                  "description": "이전 Step 반환값에서 추출할 키·인덱스 경로 배열. []는 반환값 전체이며 새 규격은 Python 식을 평가하지 않는다. legacy는 문자열 selector다. 필수 필드."
                }
              },
              "required": [
                "source",
                "step_id",
                "selector"
              ]
            },
            {
              "type": "object",
              "additionalProperties": false,
              "properties": {
                "source": {
                  "const": "agent_report",
                  "description": "값을 얻는 방식. workflow_input/literal/step_output/agent_decision/system_context, 보고서에서는 agent_report를 구분한다. 필수 필드."
                },
                "evidence_steps": {
                  "type": "array",
                  "items": {
                    "$ref": "#/$defs/id"
                  },
                  "uniqueItems": true,
                  "description": "판단 또는 보고서가 근거로 사용할 Step ID 목록. 실제 실행 결과를 사용한다. 필수 필드."
                }
              },
              "required": [
                "source",
                "evidence_steps"
              ]
            }
          ],
          "description": "값을 얻는 방식. workflow_input/literal/step_output/agent_decision/system_context, 보고서에서는 agent_report를 구분한다. 필수 필드."
        },
        "format": {
          "enum": [
            "native",
            "parquet",
            "markdown",
            "html",
            "json"
          ],
          "description": "산출물 표현 형식 또는 Schema 형식 제약. 산출물은 native/parquet/markdown/html/json 등을 선언한다. 선언과 실제 저장 지원은 구분한다. 필수 필드."
        },
        "when": {
          "$ref": "#/$defs/condition",
          "description": "단계 또는 산출물의 조건. false이면 해당 항목을 실행/요구하지 않으며 자유 Python 조건문을 입력하지 않는다. 생략 가능한 필드. 조건부 필수 여부는 업무 계약을 함께 확인한다."
        }
      },
      "required": [
        "id",
        "kind",
        "description",
        "required",
        "source",
        "format"
      ]
    },
    "execution": {
      "type": "object",
      "additionalProperties": false,
      "properties": {
        "mode": {
          "enum": [
            "SINGLE",
            "MULTI"
          ],
          "description": "SINGLE은 제출 계획을 한 실행 단위로, MULTI는 결과 판단·후속 Operation을 포함한 흐름으로 실행한다. 조건/decision은 MULTI가 필요하다. 생략 가능한 필드. 조건부 필수 여부는 업무 계약을 함께 확인한다."
        },
        "repair_level": {
          "type": "integer",
          "minimum": 0,
          "maximum": 4,
          "description": "허용하는 오류 수정 자율성 수준 0~4. 상세 단계별 권한은 오류 수정 Runtime 문서를 따른다. 생략 가능한 필드. 조건부 필수 여부는 업무 계약을 함께 확인한다."
        },
        "max_repair_attempts": {
          "type": "integer",
          "minimum": 0,
          "description": "허용하는 오류 수정 시도 수. 무한 반복을 허용하지 않으며 서버 상한 이하만 가능하다. 생략 가능한 필드. 조건부 필수 여부는 업무 계약을 함께 확인한다."
        },
        "review_mode": {
          "enum": [
            "decision_boundary",
            "every_tool",
            "every_n_tools"
          ],
          "description": "실행 결과 이후 확인 정책. decision_boundary/every_tool/every_n_tools을 구분한다. 일반적인 계획 최초 승인을 대체하지 않는다. 생략 가능한 필드. 조건부 필수 여부는 업무 계약을 함께 확인한다."
        },
        "review_interval_tools": {
          "type": "integer",
          "minimum": 1,
          "description": "review_mode=every_n_tools에서 몇 개 Tool마다 확인할지 정하는 값. 생략 가능한 필드. 조건부 필수 여부는 업무 계약을 함께 확인한다."
        }
      },
      "required": []
    }
  },
  "$comment": "Used by the current agentic planning, approval and execution compiler. Workflow CRUD still uses the separate legacy 1.3 contract; this definition is not directly accepted by Workflow POST."
}
